{
  "inputValidation" : {
    "textInputWithDefault" : "placeholder",
    "textInputWithDynamicDefault" : "node1",
    "selectBox" : "SHORT"
  },
  "readOnly" : {
    "derivedDateTimeInput" : "2022-01-04T11:22:33.000Z",
    "readOnlyEmailConfig" : [ "user1@ericsson.com", "user2@ericsson.com" ],
    "readOnlyTable" : [ {
      "packageName" : "Package0",
      "productName" : "Product0",
      "productId" : 0,
      "packageTitle" : "Test package title0",
      "nodeDistance" : 0,
      "nodeType" : "Node Type0",
      "customDetails" : "Derived Data generated by the flow0"
    }, {
      "packageName" : "Package1",
      "productName" : "Product1",
      "productId" : 1,
      "packageTitle" : "Test package title1",
      "nodeDistance" : 1,
      "nodeType" : "Node Type1",
      "customDetails" : "Derived Data generated by the flow1"
    } ],
    "readOnlyListBox" : [ "Read Only List Value 1", "Read Only List Value 2", "Read Only List Value 3", "Read Only List Value 4" ],
    "derivedData" : "placeholder + content added by the flow",
    "shortInformation" : "This is short information"
  },
  "softwarePackage" : {
    "softwarePackageName" : "name1",
    "softwarePackageVersion" : "version1"
  },
  "network" : {
    "network" : "network1",
    "subnetwork" : "subnetwork1"
  },
  "nestingAndGrouping" : {
    "nesting" : {
      "level1TextInputs" : {
        "level2Group1" : {
          "textInput1" : "group1Text1",
          "textInput2" : "group1Text2"
        },
        "level2Group2" : {
          "textInput1" : "group2Text1",
          "textInput2" : "group2Text2"
        }
      },
      "level2Checkboxes" : {
        "level2Group1" : {
          "checkbox1" : true,
          "checkbox2" : true
        },
        "level2Group2" : {
          "checkbox1" : true,
          "checkbox2" : true
        }
      }
    },
    "nestingWithCheckbox" : {
      "selectOption" : {
        "option1" : true,
        "option2" : true,
        "other" : {
          "nestedTextInput" : "nestedCheckBoxValue"
        }
      }
    },
    "nestingWithRadio" : {
      "radioButton" : {
        "optionWithNesting" : {
          "nestedTextInput" : "nestedRadioValue"
        }
      }
    }
  }
}